{
  "agent_id": "the-inventor",
  "version": "v1.0",
  "timestamp": "2025-10-10T12:00:00Z",
  "report_type": "ideation",
  "content": {
    "ideas": [
      {
        "id": "idea_code_splitting",
        "description": "Implement route-based and component-based code splitting using React.lazy() and dynamic import() to reduce initial bundle size. Split code at route boundaries and defer loading of heavy components (charts, tables, modals) until needed.",
        "novelty_score": 0.2,
        "dimensions": {
          "mechanism": "Webpack code splitting with React.lazy() and Suspense boundaries",
          "experience": "Faster initial page load with loading fallbacks for deferred content",
          "market": "All users benefit, especially mobile users on slow networks",
          "data_approach": "Client-side bundle orchestration with lazy chunk loading"
        },
        "rationale": "Industry standard approach with proven ROI. Can typically reduce initial bundle by 40-60% with minimal code changes. Well-supported in React 18 ecosystem.",
        "initial_concerns": [
          "Requires careful Suspense boundary placement to avoid layout shifts",
          "May increase number of network requests if not chunked strategically",
          "Loading states need UX design to prevent jarring transitions"
        ],
        "related_ideas": ["idea_skeleton_screens", "idea_prefetch_hover"]
      },
      {
        "id": "idea_virtual_scrolling",
        "description": "Replace TanStack Table's default rendering with virtualized rendering using react-window or @tanstack/react-virtual. Only render visible rows plus small buffer, dramatically reducing DOM nodes for large datasets (1000+ rows).",
        "novelty_score": 0.3,
        "dimensions": {
          "mechanism": "DOM virtualization with windowing algorithm for lists/tables",
          "experience": "Smooth scrolling for large datasets without performance degradation",
          "market": "Power users viewing large reports and data tables",
          "data_approach": "Client-side rendering of visible viewport only"
        },
        "rationale": "Analytics dashboards often display 10K+ row datasets. Virtualizing reduces DOM nodes from 10,000 to ~50, eliminating major FID bottleneck.",
        "initial_concerns": [
          "Dynamic row heights complicate implementation and may cause scroll jumps",
          "Accessibility concerns - screen readers may not handle virtualization well",
          "Export to CSV/PDF features need refactoring to work with virtualized data"
        ],
        "related_ideas": ["idea_web_workers"]
      },
      {
        "id": "idea_service_worker",
        "description": "Implement service worker with Workbox for aggressive caching of static assets, API responses, and stale-while-revalidate strategy. Enable offline functionality and instant repeat visits.",
        "novelty_score": 0.4,
        "dimensions": {
          "mechanism": "Service worker with cache-first and network-first strategies",
          "experience": "Near-instant repeat page loads and offline capability",
          "market": "All users, especially those with unreliable connectivity",
          "data_approach": "Browser cache layer with background revalidation"
        },
        "rationale": "Service workers can reduce repeat visit LCP by 80%+. Particularly valuable for enterprise users who open dashboard multiple times daily.",
        "initial_concerns": [
          "Complex cache invalidation logic - stale data shown to users",
          "Debugging difficulties - service worker persists across page reloads",
          "IE11 constraint may prevent implementation (no service worker support)",
          "Requires HTTPS which may complicate local development"
        ],
        "related_ideas": ["idea_cdn_migration"]
      },
      {
        "id": "idea_cdn_migration",
        "description": "Migrate all static assets (JS bundles, CSS, images, fonts) from S3 direct access to CloudFront CDN with optimal cache headers. Configure edge locations for global user base and enable HTTP/3.",
        "novelty_score": 0.2,
        "dimensions": {
          "mechanism": "CloudFront CDN with edge caching and HTTP/3 protocol",
          "experience": "Faster asset delivery from geographically distributed edge servers",
          "market": "All users, especially international enterprise customers",
          "data_approach": "CDN edge caching with origin shield on S3"
        },
        "rationale": "Already on AWS infrastructure, CDN migration is low-risk. Can reduce TTFB by 50-70% for users far from us-east-1 origin.",
        "initial_concerns": [
          "Cache invalidation during deployments - users may see mixed old/new assets",
          "CDN costs may increase monthly spend by 15-20%",
          "Monitoring and debugging become more complex with CDN layer"
        ],
        "related_ideas": ["idea_service_worker"]
      },
      {
        "id": "idea_server_components",
        "description": "Adopt React Server Components (RSC) for data-heavy dashboard sections. Render charts and tables server-side, stream HTML to client, reduce client-side JavaScript and data fetching overhead.",
        "novelty_score": 0.8,
        "dimensions": {
          "mechanism": "React Server Components with streaming SSR and selective hydration",
          "experience": "Faster perceived load with progressive enhancement of interactive features",
          "market": "All users benefit from reduced JS bundle, especially low-end devices",
          "data_approach": "Server-side data fetching and rendering, client receives HTML stream"
        },
        "rationale": "Bleeding-edge approach that addresses root cause: too much client-side rendering. Can reduce bundle by 60%+ and eliminate waterfall API requests.",
        "initial_concerns": [
          "React Server Components still experimental, production stability unknown",
          "Requires Next.js 13+ app directory, major framework migration",
          "Team has no SSR experience, steep learning curve",
          "Backend Lambda functions may need rewrite for streaming responses",
          "2-month timeline insufficient for full RSC migration"
        ],
        "related_ideas": ["idea_code_splitting", "idea_web_workers"]
      },
      {
        "id": "idea_memoization",
        "description": "Audit all components for unnecessary re-renders. Implement React.memo(), useMemo(), useCallback() strategically on expensive chart calculations, data transformations, and Redux selectors. Add React DevTools Profiler instrumentation.",
        "novelty_score": 0.1,
        "dimensions": {
          "mechanism": "React memoization hooks and HOCs to skip redundant renders",
          "experience": "Smoother interactions and reduced input delay during data updates",
          "market": "All users, especially noticeable during live data updates",
          "data_approach": "Client-side computation caching and render optimization"
        },
        "rationale": "Low-hanging fruit. Typical React apps have 30-50% unnecessary re-renders. Redux selectors in analytics apps are prime candidates for memoization.",
        "initial_concerns": [
          "Over-memoization can increase memory usage and add complexity",
          "Requires careful dependency array management to avoid stale closures",
          "Marginal gains if fundamental architecture issues exist"
        ],
        "related_ideas": ["idea_web_workers", "idea_virtual_scrolling"]
      },
      {
        "id": "idea_progressive_images",
        "description": "Implement progressive image loading with blur-up technique. Serve tiny base64-encoded placeholders inline, lazy load full images with Intersection Observer, use WebP format with JPEG fallback for IE11.",
        "novelty_score": 0.3,
        "dimensions": {
          "mechanism": "Progressive image loading with blur-up placeholders and format negotiation",
          "experience": "Perceived faster load with smooth image transitions instead of blank boxes",
          "market": "All users viewing dashboard visualizations and user avatars",
          "data_approach": "Dual image pipeline with placeholder generation and lazy loading"
        },
        "rationale": "Images currently account for 1.2MB of page weight. Progressive loading improves perceived performance even if actual load time unchanged.",
        "initial_concerns": [
          "Requires build pipeline changes to generate blur placeholders",
          "WebP conversion and serving logic adds infrastructure complexity",
          "CLS risk if image dimensions not specified correctly"
        ],
        "related_ideas": ["idea_skeleton_screens", "idea_cdn_migration"]
      },
      {
        "id": "idea_prefetch_hover",
        "description": "Implement intelligent prefetching on hover/focus for navigation links and dashboard tiles. Use requestIdleCallback to prefetch likely next pages during browser idle time based on user behavior analytics.",
        "novelty_score": 0.5,
        "dimensions": {
          "mechanism": "Predictive prefetching with hover intent detection and idle-time background loading",
          "experience": "Instant page transitions when users click already-prefetched routes",
          "market": "Power users who navigate frequently between dashboard sections",
          "data_approach": "Client-side route prefetching with analytics-driven prediction"
        },
        "rationale": "Users typically spend 2-3 seconds hovering before clicking. Prefetching during hover intent makes navigation feel instant with zero perceived latency.",
        "initial_concerns": [
          "Wasted bandwidth if user hovers but doesn't click (false positives)",
          "Privacy concerns - reveals user browsing intent before commitment",
          "Mobile users don't have hover, need touch-based alternative"
        ],